diagnostic,value,interpretation
mean_history_weeks,278.0,"Длина истории определяет, можно ли оценивать сезонность и строить rolling backtesting"
mean_zero_share,0.0,Доля нулей показывает риск прерывистого спроса и ограничение для среднеквадратичных моделей
mean_cv,0.180096599497828,Коэффициент вариации характеризует относительную шумность ряда
mean_trend_strength,2.6836546641714745,"Нормированная сила линейного тренда позволяет понять, достаточны ли чисто сезонные бейзлайн"
seasonal_acf_lag_52_mean,0.586546613532015,Автокорреляция на 52 неделях проверяет гипотезу о годовой сезонной памяти
seasonal_acf_lag_13_mean,0.7738433007888003,Автокорреляция на 13 неделях проверяет квартальную сезонную память недельных рядов
seasonal_acf_lag_26_mean,0.7001983675088427,Автокорреляция на 26 неделях помогает оценить полугодовую память и силу средних сезонных циклов
strong_seasonality_share_lag_52,1.0,"Доля рядов с заметной годовой сезонной памятью показывает, насколько Seasonal Naive обязателен как baseline"
